<?xml version="1.0" encoding="utf-8"?>
<xs:schema attributeFormDefault="unqualified" 
           elementFormDefault="qualified" 
           targetNamespace="urn:students" 
           xmlns:xs="http://www.w3.org/2001/XMLSchema">

  <xs:simpleType name="email">
    <xs:restriction base="xs:string">
      <xs:pattern value="[^@]+@[^\.]+\..+"/>
    </xs:restriction>
  </xs:simpleType>
  
  <xs:element name="students">
    <xs:complexType>
      <xs:sequence>
        <xs:element maxOccurs="unbounded" name="student">
          <xs:complexType>
            <xs:sequence>
              <xs:element name="name" type="xs:string" />
              <xs:element name="gender" type="xs:string" />
              <xs:element name="birth_date" type="xs:string" />
              <xs:element name="phone" type="xs:long" />
              <xs:element name="email" type="xs:string" />
              <xs:element name="course" type="xs:unsignedByte" />
              <xs:element name="speciality" type="xs:string" />
              <xs:element name="faculcy_number" type="xs:unsignedInt" />
              <xs:element name="exams_passed">
                <xs:complexType>
                  <xs:sequence>
                    <xs:element maxOccurs="unbounded" name="exam">
                      <xs:complexType>
                        <xs:sequence>
                          <xs:element name="exam_title" type="xs:string" />
                          <xs:element name="tutor" type="xs:string" />
                          <xs:element name="score" type="xs:unsignedByte" />
                        </xs:sequence>
                      </xs:complexType>
                    </xs:element>
                  </xs:sequence>
                </xs:complexType>
              </xs:element>
              <xs:element minOccurs="0" name="enrollment-info">
                <xs:complexType>
                  <xs:sequence>
                    <xs:element name="enrollment-date" type="xs:date" />
                    <xs:element name="exam-score" type="xs:decimal" />
                  </xs:sequence>
                </xs:complexType>
              </xs:element>
              <xs:element minOccurs="0" name="teacher-endorsments">
                <xs:complexType>
                  <xs:sequence>
                    <xs:element name="teacher-name" type="xs:string" />
                    <xs:element name="teacher-endorsement" type="xs:string" />
                  </xs:sequence>
                </xs:complexType>
              </xs:element>
            </xs:sequence>
          </xs:complexType>
        </xs:element>
      </xs:sequence>
    </xs:complexType>
  </xs:element>
</xs:schema>